Reference,Description,Source / Notes,Sourced From,Estimated Price (USD),Purchase Link
BAT1,Li-ion battery (vape cell ~3.7V 1000–1500mAh),Salvaged from found vape — free,Salvaged,$0.00,https://www.aliexpress.com/w/wholesale-18650-li-ion-battery.html
CHG1,TP4056 USB-C charging module,Salvaged / low cost module,Salvaged / AliExpress,$0.50,https://www.aliexpress.com/w/wholesale-tp4056-usb-c.html
RH1,Heating element (toaster nichrome wire),Salvaged from old toaster — free,Salvaged,$0.00,https://www.aliexpress.com/w/wholesale-nichrome-heating-wire.html
SW1,Tactile push button (6×6mm momentary NO),Salvaged from scrap electronics,Salvaged,$0.10,https://www.aliexpress.com/w/wholesale-6x6mm-tactile-push-button.html
—,Silicone wire AWG 22–24 (heat-resistant),Salvaged from old cable — ~30cm red + black,Salvaged,$0.30,https://www.aliexpress.com/w/wholesale-silicone-wire-awg22.html
—,Crocodile / alligator clips,Salvaged from test leads,Salvaged,$0.00,https://www.aliexpress.com/w/wholesale-alligator-clips.html
—,3D printing filament (PLA or PETG ~40g),Estimated filament consumption for enclosure,Own stock,$0.80,https://www.aliexpress.com/w/wholesale-pla-filament-1kg.html
—,M2/M3 screws + brass heat-set inserts (×4–6),Salvaged / hardware bin,Salvaged / Own stock,$0.50,https://www.aliexpress.com/w/wholesale-m3-heat-set-insert-brass.html
,,,,Total (est.):,$2.20,
